project_url,project_title,Deployment Type,Reason,Cloud
https://github.com/Avyukth/mlops-Zoomcamp/tree/main/notebooks/project-01,Heart Disease Prediction Pipeline,"Batch, Web Service","The repository contains both batch processing components (Docker Compose setup with MLflow for model training, orchestrated via Docker containers) and web service components (FastAPI API for model serving and Streamlit dashboard for visualization). The MLflow training setup represents batch model training, while the FastAPI and Streamlit applications provide web service interfaces.",Other
https://github.com/alex-s-888/Travel-Insurance-Prediction,Unknown,Unknown,No files fetched,Unknown
https://github.com/ppatrzyk/rss-store,Text Classification Model Training,"Batch, Web Service",The project uses Prefect for batch orchestration to continuously update RSS feeds and retrain ML models on a schedule (cron-based). It also serves ML predictions via a web service using MLflow's model serving API on port 5000.,Other
https://github.com/kachiann/mlops-project,Unknown,Unknown,No files fetched,Unknown
https://github.com/tiznobaik/mlops-zoomcamp-project/tree/main,Bank Customer Churn Prediction,Batch,"The repository contains Python scripts for data loading and preprocessing that are executed as standalone programs, indicating a batch processing workflow. The project uses Google Cloud Storage for data and includes configuration for scheduled or periodic data processing, which is characteristic of batch ETL jobs.",GCP
https://github.com/quzanh1130/chat_moderation_mlops,Chat Moderation ML Pipeline,"Batch, Web Service","The repository contains both batch and web service components. The orchestration directory uses Mage (a workflow orchestrator) for batch processing with pipelines for data processing, model training, and deployment. The app directory contains a Flask-based web service with a Dockerfile exposing port 9696 and using gunicorn, indicating a web service deployment for model inference.",Other
https://github.com/lillianphyo/mlopsprj022024.git,Myanmar Rice Price Forecasting,Web Service,"The repository contains a Flask application (run.py) served via Docker and docker-compose, with a gunicorn WSGI server on port 5000. This is a classic web service deployment pattern for serving ML predictions via API endpoints. The MLflow service is also exposed on port 5001, which is a web-based model registry and tracking server.",Other
https://github.com/shimkoji/footballer_prediction.git,Unknown,Unknown,No files fetched,Unknown
https://github.com/omjirapat/mlops-zoomcamp/tree/main/project,Bike Rental Demand Prediction System,Batch,"The project uses Prefect for workflow orchestration with batch prediction scripts (batch_predict.py) that run on scheduled inputs (year, season). The architecture includes MLflow for model tracking and batch deployment, with no streaming components or web service APIs for real-time inference.",Other
https://github.com/begoechavarren/sermadrid,SER Zone Time Series Forecasting,Web Service,"The repository contains a FastAPI backend application that serves ML models for parking availability predictions via API endpoints, and a Vue.js frontend served by nginx. The backend loads models at startup and responds to user requests, which is characteristic of a web service deployment pattern.",Other
https://github.com/SebastianSydlik/MRI-based-dementia-prediction,MRI Brain Scan Dementia Predictor,Web Service,The repository contains a Flask-based prediction service (predict.py) with a Dockerfile exposing port 9696 and using gunicorn to serve the model. The predict.py file implements a Flask app with an /predict endpoint that accepts POST requests with MRI scan data and returns dementia probability predictions. This is a classic web service deployment pattern for ML models.,Other
https://github.com/hwting1/MLOps-Zoomcamp-Project,London Bicycle Rental Predictions,Batch,"The repository uses Prefect for workflow orchestration to run scheduled ETL jobs (batch_predict.py with parameters), MLflow for model tracking, and performs batch predictions on data files rather than serving real-time API requests or streaming data.",Other
https://github.com/oelghareeb/mlops-zoomcamp-project,Image Upload Prediction Service,Web Service,"The repository contains a Flask web application (deploy.py) that serves a CNN model for fashion item classification via HTTP endpoints. Users can upload images and receive predictions through a web interface. The Dockerfile and Makefile are configured to run this Flask app, confirming it's a web service deployment.",AWS
https://github.com/alex-s-888/Travel-Insurance-Prediction-V1,Unknown,Unknown,No files fetched,Unknown
https://github.com/AbdelrahmanElmasry/mlops-bike-share-prediction,Bike Share Membership Prediction,Web Service,"The repository contains a Dockerfile that builds a Flask-based prediction service using gunicorn to serve an ML model (linear_reg.bin) via API on port 9696. The predict.py file (referenced in the Dockerfile) implements a Flask app for model inference, which is characteristic of a Web Service deployment pattern.",AWS
https://github.com/Bt-PplusK/Mlops-project-1/tree/main,Unknown,Unknown,No files fetched,Unknown
https://github.com/AP0202/ml-Data_Science_Salary_Estimator,Data Science Salary Predictor,Web Service,"The repository contains a Flask web service (predict.py) that exposes a REST API endpoint at port 9696 for salary prediction. The Dockerfile and docker-compose.yml are configured to run this web service, and the README describes containerizing the project for deployment.",Other
https://github.com/KevinPericart/MLOps-Project/tree/main,AWS MLOps Infrastructure Pipeline,Batch,"The project uses Prefect for workflow orchestration with tasks for data preparation, preprocessing, embedding, and model training. The code shows a Prefect flow with multiple tasks that run sequentially to train and evaluate a CatBoost model, which is characteristic of batch processing rather than real-time streaming or web service deployment.",AWS
https://github.com/victornemenike/fuel-price-prediction,Unknown,Unknown,No files fetched,Unknown
https://github.com/mleiwe/F1_PredictQualifying,Formula 1 Lap Time Forecast,Unknown,"The repository contains data access and analysis code but no clear deployment infrastructure, orchestration workflows, API services, or streaming components are visible in the provided files.",Unknown
https://github.com/thiagoribeiro00/MLOps-Azure-Recomendation/tree/main,Flask Web App Serving,Web Service,"The repository contains a Dockerfile that runs ""app.py"" and uses Flask in requirements.txt, indicating this is a web service application. The README also mentions serving ML models via API using Flask/FastAPI/BentoML.",Azure
https://github.com/gsenseless/mlOps_wrap,Vehicle MPG Prediction System,Batch,The repository contains a Docker-based ML training script (train_model.py) and prediction script (predict.py) that are executed as discrete command-line jobs via docker compose run. The workflow is triggered manually/scheduled rather than serving continuous API requests or real-time streaming.,AWS
https://github.com/lillianphyo/mlohttps://github.com/lillianphyo/mlopsprj012024.gitpsprj012024.git,Unknown,Unknown,No files fetched,Unknown
https://github.com/ParthRajauria/PredictingStudentGrade_EndToEndMLOPs/tree/main,Education Data ML Pipeline,Batch,"The repository uses Prefect for model orchestration, which is a workflow orchestrator for scheduled/batch processing. The project follows MLOps practices with experiment tracking (MLflow) and batch model training pipelines, but shows no evidence of streaming or web service deployment.",Other
https://github.com/haghighi2697/mlopsproject,Machine Learning Artifact Repository,Unknown,"The repository contains only MLflow model artifacts and requirements files, with no actual code for deployment, orchestration, or serving. No evidence of batch workflows, web services, or streaming components can be found.",Unknown
https://github.com/quickSilverShanks/ReviewSentinel,Machine Learning Review Scanner,Batch,"The repository uses Mage AI, a workflow orchestrator for ETL pipelines, with scheduled data processing jobs (data_preparation, data_profiling, model_training). The architecture shows batch-oriented components like scheduled pipelines, data versioning, and periodic model training rather than real-time streaming or continuous API serving.",Other
https://github.com/gsenseless/mlOps_bikesharing,ML-Powered Bike Sharing System,"Batch, Web Service","The project uses Apache Airflow (DAGs) for batch data processing and model training, and also provides a Flask/FastAPI-based prediction API service for real-time inference.",Other
https://github.com/toema/mlops-mage,Taxi Tip ML Model Deployment,Batch,"The repository uses Mage.ai, a workflow orchestrator, to run scheduled ML pipelines. The docker-compose.yml shows Mage starting with ""mage start"" command, and the project structure contains multiple pipelines for data processing and model training. This is a batch-oriented ML pipeline system rather than a real-time streaming or web service deployment.",AWS
https://github.com/alexeygrigorev/build-your-own-search-engine,Zoomcamp FAQ Search Engine,Unknown,"The repository contains educational code for building a search engine with no actual deployment infrastructure, orchestration, or service components. It's a workshop with Jupyter notebooks and Python scripts for learning purposes.",Unknown
https://github.com/brnakin/MLOps-Zoomcamp/tree/main/project,Hyperopt Hyperparameter Optimization Lab,Unknown,"The repository contains only MLflow model artifacts, requirements files, and a Jupyter notebook for model training and experimentation. There is no code for deployment, serving, or orchestration that would indicate batch processing, web service APIs, or streaming pipelines.",Unknown
https://github.com/ellacharmed/mlops-zoomcamp/tree/main/07-project,ML Infrastructure Deployment Pipeline,"Batch, Web Service","The repository contains a course project template with instructions for building end-to-end ML projects. The README describes three deployment options: batch scoring, web service (Flask/FastAPI), and streaming (Kafka/Kinesis). The project structure includes modules for both batch deployment (Module 4 covers batch scoring) and web service deployment (Flask-based model serving). No actual streaming implementation code is present in the repository.",Unknown
https://github.com/ReemJbily/MLOPS/blob/main/01-intro/homework.ipynb,ML Model Performance Monitoring,Unknown,"The repository contains only a Jupyter notebook with a simple machine learning homework exercise (training a linear regression model on the California housing dataset). There is no code for deployment, orchestration, API serving, or streaming infrastructure.",Unknown
https://github.com/s100rab/s100rab_MLOps_DataTalks_zoomcamp/tree/main/project_1_main,Automated Wine Model Training,"Batch, Web Service",The project includes both batch orchestration (Prefect workflows for model training/registration) and web service deployment (FastAPI/gunicorn service on port 9696 for model inference),Other
https://github.com/Yasser314/Proyecto_1,Unknown,Unknown,No files fetched,Unknown
