project_url,project_title,Deployment Type,Reason,Cloud
https://github.com/Hokfu/campaign_success_prediction_with_mlops,Campaign Performance Monitoring System,"Batch, Web Service","The repository contains both batch deployment (orchestration/mlops/etl.py, orchestration/mlops/pipelines/etl) and web service deployment (deployment/web_service_deployment/Dockerfile with FastAPI/uvicorn, deployment/batch_deployment/Dockerfile for batch processing). The batch component uses Mage workflow orchestrator for ETL pipelines, while the web service component serves ML models via API endpoints.",Other
https://github.com/Isaac-Ndirangu-Muturi-749/Car-Price-Prediction-End-to-End-MLOps-Pipeline,Car Price Prediction Pipeline,Web Service,"The repository contains a Flask web service for serving ML model predictions (app.py, test_predict.py) and Docker configurations for containerizing this service. The deployment uses MLflow for model serving and includes Dockerfiles specifically for web service deployment.",AWS
https://github.com/Jaykold/dry-bean-predictor,Dry Bean Classification System,Web Service,"The project serves ML models via a Flask API (app.py) and includes a predict.py component for model inference. The Dockerfile exposes port 9696 and uses gunicorn to serve the Flask application, confirming it's a web service deployment.",Other
https://github.com/jingxp/nasa-neo-hazard-prediction.git,NEO Hazard Prediction Pipeline,"Batch, Web Service",The repository contains both a Prefect workflow orchestrator (training_flow.py) for batch processing and a Flask API (app.py) for serving ML model predictions. The docker-compose shows both services running together.,Other
https://github.com/btalha23/Personalized_Recipe_Recommender,LSTM Recipe Model Pipeline,"Batch, Web Service","The repository contains a Prefect workflow orchestration (training_orchestration.py) that runs scheduled ETL jobs for model training and experiment tracking, which is characteristic of Batch deployment. It also includes a Dockerfile for containerizing the model as a web service (gunicorn server on port 9696) and deployment to AWS EC2, indicating Web Service deployment.",AWS
https://github.com/blackBagel/NHTSA-FARS-MLOps-Project,Car Accident Severity Prediction,"Batch, Web Service","The project uses Prefect for orchestrating batch data processing workflows (datasets_updater) and ML model training (model_trainer), while also serving predictions via a Flask-based web service (accident-injury-prediction-service on port 9696).",GCP
https://github.com/gokuld/product-category-prediction/tree/dev,Flask API Product Categorization,Web Service,"The repository README states it's a ""Machine learning model as a service to classify product description text into categories."" The codebase includes Terraform infrastructure for AWS deployment with VPC, subnets, and networking components, indicating a web service architecture for serving ML model predictions via API endpoints.",AWS
https://github.com/ReveredEye/DnDClassClassification,Character Data Classification Pipeline,"Batch, Web Service","The project uses Airflow (DAGs) for batch processing of data and model training, and Flask for serving ML predictions as a web service. The Airflow DAG orchestrates ETL and model training jobs, while the Flask app serves the trained model via API endpoints.",Other
https://github.com/AbdallaAbker/MLOps_Canadian_Forest_Fire_Prediction,Canadian Forest Fire Risk Prediction,Web Service,"The repository contains a FastAPI application (app.py) and Docker configuration for serving ML model predictions via API endpoints. The Dockerfile exposes port 8000 and runs Uvicorn to serve the FastAPI app. Additionally, there's a Streamlit dashboard for model deployment and monitoring. The project is focused on serving ML model predictions rather than batch processing or streaming data.",Azure
https://github.com/ruqianq/aws-xgboost-mlops-project/tree/main,AWS Serverless ML Model Deployment,Batch,"The repository uses Mage AI as a workflow orchestrator to automate ML training pipelines. The orchestration directory contains Docker Compose and Dockerfile configurations for Mage, along with requirements for hyperopt and MLflow, indicating scheduled/batch execution of training jobs rather than real-time streaming or web service deployment.",AWS
https://github.com/celik-muhammed/MLOps-Zoomcamp-M7-Project-Attempt-1-Mushroom-Classification,Mushroom Classification Pipeline,Batch,"The repository contains Mage workflow files (mage_0_ingest_data.py, mage_1_train_model.py, mage_2_batch_prediction.py) which are batch ETL/orchestration jobs. The project uses Docker Compose for local orchestration and includes batch prediction scripts (predict_batch_s3.py) with scheduled execution patterns. No streaming components (Kafka, Flink) or web service APIs are present.",Other
https://github.com/mj-ml/spain-energy-forecasting,Unknown,Unknown,No files fetched,Unknown
https://github.com/ruqianq/aws-xgboost-mlops-project,Mage AI MLOps Restaurant Solution,"Batch, Web Service","The project uses Mage AI for batch orchestration of ML training pipelines (evidenced by Dockerfile and docker-compose.yml in orchestration/), and deploys models as AWS Lambda functions for web service inference (evidenced by Flask/MLflow in deployment/requirements.txt and Lambda deployment in CDK code).",AWS
https://github.com/amitkooner/mlopszoomcamp_final_project/tree/main/final_project,Bike Rental Demand Forecast,Web Service,"The project serves a trained machine learning model via a Flask web service (app.py) that exposes a /predict API endpoint for receiving predictions. The Dockerfile is configured to run app.py, indicating this is deployed as a web service for model inference.",GCP
https://github.com/cjvandijk/predict_machine_failure,Machine Failure Prediction Pipeline,"Batch, Web Service","The repository contains a Mage AI pipeline for batch data processing and model training, and a Flask/Gunicorn prediction webservice for serving ML models via API. The docker-compose shows both components running as separate services.",Other
https://github.com/aalvan/mlops-diabetes,Diabetes Prediction Pipeline,"Batch, Web Service","The repository contains both a Mage orchestration pipeline (src/mlops) for batch processing of data preprocessing, model training, and evaluation, and a web service component (src/web-service-mlflow) that serves the diabetes prediction model via API on port 9696 using Docker.",Other
https://github.com/the-horhe/mlops-zoomcamp-project,Meteorological Data Pipeline,"Batch, Web Service","The repository contains a training pipeline orchestrated by Dagster (batch processing) and a Flask-based web service for model inference. The training pipeline runs scheduled jobs to train and register models, while the web service exposes a REST API for predictions.",AWS
https://github.com/sushant0709/sarcasm-detection,ML-Powered Text Analysis Pipeline,Web Service,"The repository contains a FastAPI application (main.py) deployed as an AWS Lambda function with API Gateway integration. The code shows a REST API endpoint (/predict) that serves ML model predictions for sarcasm detection. The Dockerfile and deployment configuration are specifically for serving the model via HTTP API, not for batch processing or streaming data pipelines.",AWS
https://github.com/jdaguilar/mlops_zoomcamp_project,Bank Churn Prediction Platform,"Batch, Web Service","The repository contains a Mage AI workflow orchestrator (mlops_zoomcamp_project_ml_pipeline) for batch ML pipeline execution, and a Flask web service (web_service/Dockerfile) for serving ML model predictions via API. The Mage pipeline handles ETL/data processing steps, while the Flask app provides real-time inference endpoints.",Other
https://github.com/QuentinElGuay/belo-horizonte-pricing,Belo Horizonte Real Estate Pricing,Batch,"The repository contains an Airflow DAG (auto_training.py) that schedules model training jobs monthly, indicating a batch processing workflow for MLOps. The project uses DockerOperator to run training tasks in containers on a schedule.",AWS
https://github.com/vucongtuanduong/heart-disease-prediction-mlops,Heart Disease Prediction Pipeline,"Batch, Web Service","The repository contains both batch deployment scripts (using Docker for scheduled predictions) and web service deployment components (Flask, Gunicorn for real-time API serving). The orchestration directory uses Mage for workflow automation, which is a batch-oriented orchestrator.",Other
https://github.com/zhelanov/diabetes-prediction-model,Diabetes Health Indicators Analytics,Batch,"The project implements a batch ML pipeline using Prefect for workflow orchestration, with scheduled model training and validation jobs. The code shows batch processing patterns with periodic data extraction, model training, and experiment tracking rather than real-time streaming or web service deployment.",AWS
https://github.com/PaulinaLP/cancer-detection,Skin Cancer Detection Pipeline,"Batch, Web Service","The project uses Airflow DAGs for batch processing (data ingestion, preprocessing, training) and Flask-based web service for model deployment with Docker. The Airflow DAGs handle scheduled ETL/training workflows, while the Flask service serves predictions via API.",Other
https://github.com/hr-02/Email-spam-detection,Email Spam Detection Pipeline,"Batch, Web Service","The project uses Prefect for workflow orchestration (batch processing) and includes Docker-based model serving with a predict.py entrypoint (web service). The Dockerfile shows a containerized prediction service, while prefect.yaml and deployment orchestration indicate batch pipeline execution.",AWS
https://github.com/RAGHUBIHARI/car-price-prediction.git,Used Car Price Prediction,"Batch, Web Service","The repository contains a Prefect workflow for batch processing (ETL, hyperparameter tuning, model registration) and a Flask application for serving predictions via API. The Dockerfile exposes port 4545 and runs predict.py, indicating a web service deployment for model inference.",Other
https://github.com/Muhongfan/MLops-zoomcamp-2024/tree/mlops-project,Electric Vehicle Consumption Analytics,"Batch, Web Service","The repository contains Mage (an orchestration tool) for batch ETL workflows and a web service component (Flask/FastAPI) for serving ML models via API. The Mage setup indicates batch processing, while the Dockerfile and predict.py suggest a web service deployment.",AWS
https://github.com/hadrrb/predict-online-game-behaviour-mlops,Flask API Game Model,"Batch, Web Service","The project uses Mage AI for batch orchestration (training pipeline) and Flask for web service deployment (model API). The Mage pipelines handle scheduled ETL/training jobs, while the Flask app serves the ML model via API endpoints.",Other
https://github.com/jesusoviedo/paraguay-public-servant-salary-calculato,Paraguay Government Data ML Pipeline,"Batch, Web Service","The project contains Mage AI pipelines for batch data processing and MLflow for model tracking, plus deployment configurations for web services (Flask API, Streamlit dashboard). The pipelines handle scheduled ETL jobs while the deployment folder contains web service components.",AWS
https://github.com/MCAyd/mlops-webservice-streaming-insurance-premium-prediction,MLOps Insurance Premium Pipeline,"Streaming, Web Service",The project serves ML models via a Flask web service (web_service/routes.py) and uses AWS Kinesis for real-time data streaming between the web app and Lambda function. Lambda processes streaming data from Kinesis input stream and returns predictions via Kinesis output stream.,AWS
https://github.com/nathadriele/mlops-zoomcamp-project-paris-price-house,Paris Real Estate ML Pipeline,"Batch, Web Service","The project contains both batch and web service components. The batch component is evidenced by the Prefect flow (paris_housing_prefect_flow.py) that orchestrates scheduled model training and deployment tasks. The web service component is evidenced by the Flask API (paris_housing_api.py) that serves the trained model for predictions, along with Docker deployment configurations.",Other
https://github.com/victorfxz/Apartment-Rental-Predictor/tree/main,São Paulo Apartment Price Predictor,"Batch, Web Service","The project includes a Flask web service (front-end/app.py) for serving ML predictions and a Prefect workflow (prefect_flow.py) for training/prediction orchestration, indicating both web service and batch components.",Other
https://github.com/kabiromohd/Ride-Duration-Prediction,Divvy Bikeshare Duration Prediction,"Batch, Web Service","The repository contains both batch processing components (Mage workflow orchestrator for ETL jobs, data preparation, and model training) and web service components (Flask-based model deployment with Docker, deployment to Render cloud service, and API endpoints for model inference). The batch component handles scheduled data processing and model training, while the web service component serves the trained model via API endpoints.",AWS
https://github.com/ipekguler/Weather-Prediction-Web-Service,Weather Forecast Web Service,Web Service,"The repository contains a Flask-based web service (predict.py) that serves ML model predictions via HTTP API on port 9696, with Docker containerization for deployment. The web service is explicitly described as a ""web service integrated with MLFlow using Flask and gunicorn"" for weather prediction.",Other
https://github.com/Alexander-Heinz/autoscout-price-prediction,German Used Car Price Prediction,"Batch, Web Service","The project uses Mage for batch data processing and model training pipelines, and includes a Dockerized web service for serving ML model predictions via REST API. The docker-compose shows both Mage (batch orchestrator) and a webservice component.",Other
https://github.com/dmytrovoytko/mlops-spacy-sentiment-analysis,Amazon Reviews Sentiment Analysis,Web Service,"The repository contains a Flask-based prediction service (app.py, predict.py) with a Dockerfile exposing port 5000 and using Gunicorn as the WSGI server. The service loads a trained SpaCy model and serves predictions via API endpoints. There are no workflow orchestrators, message brokers, or streaming components present.",Other
https://github.com/atishgautam07/max-reutrns-mlops,Technical Indicators ML Pipeline,Batch,"The repository contains a Kubeflow/Vertex AI pipeline with containerized components (data ingestion, transformation, model training, evaluation, prediction, monitoring, simulation) orchestrated as batch jobs. The Dockerfiles and entrypoints indicate scheduled/triggered execution rather than continuous streaming or web service deployment.",GCP
https://github.com/francobach47/MusicGenreClassification,Music Genre Classification System,"Batch, Web Service","The repository contains both batch processing components (Airflow DAG for orchestration, preprocessing and training scripts) and web service components (Flask dependency in pyproject.toml, inference.py for model serving). The Airflow DAG indicates scheduled/batch ETL workflows, while Flask and inference capabilities suggest a web service for model serving.",Other
https://github.com/WayneHsiao0225/mlops-zoomcamp_project,Financial Services Retention Analytics,Batch,"The repository uses Prefect for workflow orchestration with scheduled ETL jobs (training.py, evidently_metrics_calculation.py) and Docker Compose for deployment. The ML model is trained in batch mode using MLflow for experiment tracking, and there are no streaming components like Kafka or real-time APIs for ML inference.",Other
https://github.com/Gjloz009/mlops_proyect_jaf/,Federal Telecom Data Pipeline,Batch,"The repository contains Airflow DAGs (etl_ift.py, etl_ift_toy_model.py) that orchestrate scheduled ETL jobs. The docker-compose.yaml sets up Airflow with CeleryExecutor for batch processing. The workflow downloads files, transforms data, and loads to S3 - all batch-oriented operations.",AWS
https://github.com/AkanimohOD19A/submission_MLOPs24-cohort,Taxi Fleet Optimization Pipeline,"Batch, Web Service","The repository contains a ZenML training pipeline with steps for data ingestion, cleaning, and model training, indicating batch processing. It also includes Streamlit for model serving/visualization, indicating a web service component. The presence of MLflow model deployment further supports the web service aspect.",Unknown
https://github.com/HemalathaRamanujam2022/mlops_temperature_prediction,Weather ML Model Deployment,"Batch, Web Service","The repository contains both batch and web service components. The batch component is orchestrated using Prefect for data preparation, feature engineering, model training, hyperparameter tuning, and model tracking. The web service component is implemented using Flask to serve the trained model as a REST API for making temperature predictions.",AWS
https://github.com/Tobai24/In-Hospital-Mortality-Prediction,Clinical Data Monitoring Pipeline,"Batch, Web Service","The repository contains both batch processing components (Mage pipeline for ETL/orchestration, MLflow for experiment tracking) and web service components (Flask API for model serving, Streamlit dashboard for visualization, Grafana dashboards for monitoring). The Mage pipeline handles scheduled data processing while the Flask application serves the ML model predictions via API.",GCP
https://github.com/alex-kolmakov/divelog-autoreport/tree/main,SCUBA Dive Analytics Pipeline,Batch,"The repository uses MageAI (0.9.73) as an orchestrator with a docker-compose setup that runs scheduled ETL jobs. The code includes dlt (data load tool) pipelines for REST API extraction and LanceDB vector storage, along with MLflow for model tracking. The structure shows batch-oriented workflows rather than real-time streaming or web service deployment.",Other
https://github.com/ArturGR3/MLOps-project,Flask ML Service Template,Web Service,"The repository contains a Flask application (predict.py) with Dockerfile and Makefile for containerization and orchestration. The Makefile shows commands to build and start a Flask app container, simulate requests, and includes Prometheus monitoring. This is a classic web service deployment pattern serving ML models via API endpoints.",GCP
https://github.com/baidlowi/prediction-student-performance.git,Student Performance Prediction Service,"Batch, Web Service","The project includes a Flask-based prediction service (studentpred_service) that serves ML models via API, and uses Prefect for orchestrating data pipelines and workflows. The docker-compose.yml shows both web service components (Flask apps on ports 9696, 8085) and mentions Prefect for pipeline automation in the README.",Other
https://github.com/TommyBark/LitigAItor-mini/,Legal RAG Model Deployment,"Batch, Web Service","The project has a Prefect workflow orchestrator (batch processing) for RAG flows and model training, plus a Gradio web interface (web service) for the chatbot interface. The Dockerfile shows the main application runs on port 7860 with Gradio.",AWS
https://github.com/Tiamz01/Drinking-water-safety-classification,ML-Powered Water Quality Monitoring,Web Service,"The repository contains a Flask application (predict.py) and Docker configuration for serving ML model predictions via HTTP API on port 9696. The Dockerfile uses gunicorn to serve the Flask app, and the testing/README.md explicitly states ""Deploying a model as a web-service"" with instructions for running the Docker container.",GCP
https://github.com/maks36-dev/loan-approval-prediction,Loan Approval Prediction Pipeline,"Batch, Web Service","The project includes batch processing components (data preprocessing, model training, hyperparameter optimization via init.py) and a web service component (Flask app.py for serving predictions via API). The docker-compose.yml also shows database and monitoring services typical of batch ML pipelines.",Other
https://github.com/nilarte/mlops-zoomcamp-project-cohort-2024.git,Employee Salary Prediction Pipeline,"Batch, Web Service","The repository contains both batch processing components (Mage pipeline for model training with ingest, train, and save stages) and web service components (Gradio-based model deployment on HuggingFace Spaces). The batch component uses Mage for pipeline orchestration, while the web service component serves the ML model via Gradio interface.",Other
https://github.com/serg123e/packing-bags-forecast,E-commerce Bag Allocation Model,Batch,"The project uses scheduled ETL jobs (upload_csv.py, download.py, ingest.py, transform.py) and batch training/prediction scripts. The architecture shows data is pulled periodically, transformed, and loaded to a warehouse for batch processing rather than real-time streaming or continuous API serving.",AWS
https://github.com/krmdel/mlops_zoomcamp24_admission_prediction_project,Admission Likelihood Forecasting Service,Web Service,"The repository contains a Flask API (predict.py) that serves ML models via HTTP endpoints (port 9696), a Streamlit web application for user interaction, and Docker configurations for containerized deployment. The code shows a web service architecture with API endpoints for prediction requests.",AWS
https://github.com/kev-wes/2024_heart_attack_mlops,Heart Attack Risk Prediction,"Batch, Web Service","The repository contains both batch processing components (Prefect workflows for model training and hyperparameter tuning orchestrated via Docker containers) and web service components (Flask-based prediction service exposed on port 8000, MLflow server on port 5000). The docker-compose.yaml shows services for both batch orchestration (Prefect) and web services (MLflow, Flask app).",Other
https://github.com/oelghareeb/mlops-zoomcamp-project/tree/main,CNN Model Deployment Platform,Web Service,"The repository contains a Flask web application (deploy.py) that serves a fashion image classifier model via HTTP endpoints. The Dockerfile exposes port 80 and runs ""flask run"", and the README shows a web interface for uploading images and getting predictions. This is a classic web service deployment pattern for ML model serving.",AWS
https://github.com/bilozorov/mlops-capstone,Heart Attack Risk Prediction,"Batch, Web Service","The project includes Mage workflow orchestration for batch ETL/model training pipelines (load_data, transform_data, train_models, register_best_model) and a Flask API containerized with Docker for serving predictions via HTTP endpoint on port 9696.",AWS
https://github.com/ldebele/End-to-End-Airbus-Ship-Detection,Satellite Ship Detection System,"Batch, Streaming, Web Service","The repository contains a multi-component system: (1) Batch pipeline for training orchestrated by Airflow with data ingestion, preprocessing, model training, and evaluation components; (2) Web Service for model inference via FastAPI endpoint; (3) Streaming pipeline using Kafka for event-driven inference with producer/consumer architecture.",Other
https://github.com/remitoudic/forcast_energy_consumption,France Energy Forecast Pipeline,"Batch, Web Service","The project uses Mage AI for pipeline orchestration (ETL jobs) which is a batch processing workflow, and FastAPI for serving ML models via API endpoints. The docker-compose shows both mage (batch orchestrator) and fastapi (web service) services running.",Other
https://github.com/a-t-em/Asthma-Prediction,Asthma Prediction Model Pipeline,Web Service,"The repository contains a Flask app (scoring_script.py) that serves ML model predictions via a REST API endpoint. The Makefile shows 'launch_app' runs 'python scoring_script.py' which starts the Flask web service. While build_model.py trains the model, the primary deployment mechanism is the web service for serving predictions.",Other
https://github.com/sam23121/crop-recomendation/tree/master,Crop Recommendation ML System,Web Service,"The repository contains a FastAPI backend deployed on AWS Lambda and a Streamlit frontend deployed on Streamlit Cloud, both serving as web services for crop recommendation. The FastAPI backend provides API endpoints for ML inference, and Streamlit serves as a web-based frontend interface.",AWS
https://github.com/XiaoLirui/MLops-project,Mobile Price Prediction Pipeline,"Batch, Web Service",The project includes a web service component (Dockerfile with gunicorn serving a Flask API on port 9696) and batch components (Prefect workflows for ML training and deployment using mobile_ml.py and mobile_ml_prefect_deploy.py).,Other
https://github.com/kahramanmurat/NYC-Bike-Share-Project,Bike Trip Time Estimation Platform,Web Service,"The project includes a Flask app (app.py) and Dockerfile for serving ML predictions via API. The README shows ""http://localhost:8080"" endpoint for usage. While there are ML pipeline components, the primary deployment mechanism is a web service for real-time predictions.",Other
https://github.com/atheeralattar/mlops-project,Flight Price Prediction Pipeline,"Batch, Web Service","The project uses Mage for batch pipeline orchestration (data prep, modeling) and Streamlit for web service model serving/visualization",Other
https://github.com/AMaldu/fraud_detection,Mobile Money Fraud Detection,"Batch, Web Service",The project uses Prefect for batch orchestration (scheduled flows in prefect.yaml) and includes a Dockerized Flask/FastAPI service (src/Dockerfile exposes port 9696) for serving predictions. The Prefect flows handle ETL/data processing while the web service provides API endpoints.,Other
