project_url,project_title,Deployment Type,Reason,Cloud
https://github.com/PK109/customer_support_rag_system,Customer Support Knowledge Base,"Batch, Web Service","The repository contains a batch processing pipeline for PDF ingestion (Makefile orchestrates sequential steps: download, convert, chunk, embed) and a Streamlit web service for interactive chat with the RAG system. The batch pipeline processes documents offline, while Streamlit provides a web-based UI for querying the knowledge base.",Other
https://github.com/Ye-Bhone-Lin/educational-tutor-ai,Vector Search Document Analyzer,Web Service,"The repository contains a Streamlit application (streamlit_app.py) that serves an AI-powered document Q&A interface via a web-based UI. The app runs continuously to handle user interactions, document uploads, and real-time question answering, which is characteristic of a web service deployment rather than batch or streaming processing.",Other
https://github.com/christos-golsouzidis/Infrang,Knowledge Base Retrieval System,Web Service,"The repository contains a FastAPI application (infrang-api.py) that exposes REST endpoints for information retrieval and generation. The Dockerfile shows it runs uvicorn to serve the API on port 7456, indicating it's a web service deployment.",Other
https://github.com/Dkaattae/Public-Filings-Chat-Bot-RAG,SEC Filings RAG Analytics,"Batch, Web Service","The repository contains batch ETL pipelines using dlt (data load tool) for scheduled data loading from S3 to Qdrant and from Yahoo Finance to DuckDB, plus a Streamlit web service for the chat interface. The pipelines are orchestrated as batch jobs, while Streamlit serves the RAG chat application.",AWS
https://github.com/kimoz1994/DIY_Home_Improvement_Assisstant,Home Improvement Video Assistant,Web Service,"The repository contains a Streamlit application (app.py) that serves as a web interface for a DIY Home Improvement Assistant. The Dockerfile shows it's containerized and exposes port 8501, which is the default Streamlit port. The README explicitly states it's a ""simple Streamlit user interface"" that allows users to submit questions and receive responses from a local LLM, which is characteristic of a web service deployment.",Other
https://github.com/belaz19/llm-explore-Norway,Norway Tourist Guide RAG,Web Service,"The project uses Docker Compose to deploy a Streamlit application that serves as a web interface for a RAG-based tourist guide. The Dockerfile and docker-compose.yml show a containerized web service running on port 8501, with Streamlit as the web framework for serving the application.",Other
https://github.com/michailmitsakis/fantasy-book-assistant,Book Metadata Chatbot Assistant,Web Service,"The repository contains a Streamlit UI (app.py) that serves as an interactive web interface for querying a book assistant. The project is designed to run as a web service where users can interact with the application through a browser, making it a Web Service deployment rather than batch processing or streaming.",Other
https://github.com/Maxkaizo/g_poke_t,Pokmon Knowledge Retrieval System,"Batch, Web Service","The repository contains a batch pipeline orchestrated via Makefile that runs ETL jobs (data ingestion, normalization, indexing) and a Streamlit web service for the RAG interface. The pipeline is not streaming-based.",Other
https://github.com/thefl0ur/dtc-llm-zoomcamp-project/,Local Cooking Advisor,Web Service,"The project uses docker-compose to run a local LLM server (llama.cpp), Qdrant vector database, and MongoDB. It provides a conversational AI interface for cooking advice via RAG system. The main components are web services: llama.cpp server on port 8080, Qdrant on port 6333, and MongoDB on port 27017. There are no workflow orchestrators, streaming message brokers, or scheduled batch jobs visible in the code.",Other
https://github.com/Gilliography/llm-zoomcamp/tree/main/Athletics%20Agent,Athletics Agent LLM Pipeline,Web Service,"The repository contains a Streamlit application (app.py) that serves as a web interface for an athletics agent, allowing users to interact with LLM-powered functionality through a web UI. This is a web service deployment pattern.",Unknown
https://github.com/JoshPola96/AIAssistantHub-LangGraph,RAG-Based Q&A System,Web Service,"The repository contains a Streamlit application (app.py) that serves as an interactive web interface for the AI assistant. The README explicitly states ""Streamlit: For the interactive web application frontend"" and provides instructions to run ""streamlit run app.py"". This is a web service deployment pattern, not batch processing or streaming.",Other
https://github.com/Nicosm1988/Project_1_rag-history-argentina,Historical Document Retrieval System,Web Service,"The repository contains a FastAPI backend (app.api) that serves a RAG system via API endpoints, with a frontend interface built using HTML/CSS/JavaScript. The code structure shows a web service architecture with API endpoints for processing queries and serving responses, not batch or streaming components.",Other
https://github.com/bekarizz/llm-zoomcamp-project,Industrial Database Natural Language Query,Web Service,The repository contains a FastAPI application (fastapi==0.115.0) and uses Docker Compose to orchestrate services including a web interface (Adminer) and likely an API service. The code structure with test.py and build_index.py suggests a web service that serves ML-generated SQL queries via API endpoints.,Other
https://github.com/Ye-Bhone-Lin/Myanmar-Cultural-Heritage-Q-A-System,Myanmar Heritage Knowledge Base,Web Service,"The repository contains a FastAPI backend (main.py) and Streamlit frontend, both serving as web services. The Dockerfile shows the application is containerized and runs uvicorn to serve the FastAPI application on port 8000. There are no workflow orchestrators, streaming components, or batch processing elements present.",Unknown
https://github.com/clicksuku/SundarkpCode/tree/master/LLM%20Zoomcamp%202025%20Project,Olist Commerce Data Pipeline,Batch,"The repository contains a Data Engineering Zoomcamp Capstone Project using MAGE AI, which is a workflow orchestrator for batch ETL jobs. The project includes Terraform configurations and BigQuery usage, indicating scheduled data processing workflows rather than real-time streaming or web service deployment.",GCP
https://github.com/A-n-i-e/Ask-Mama-Put,Ask Mama Put Culinary Guide,Web Service,"The repository contains a FastAPI backend (main.py) and React frontend served via Docker containers, with uvicorn as the ASGI server. The architecture is a web service with API endpoints for user queries and responses, not batch ETL jobs or streaming data pipelines.",Other
https://github.com/mavcr/quizmate,AI Quiz Generator Pipeline,Web Service,"The application is a Spring Boot-based web service that exposes REST APIs for quiz generation and evaluation. It uses a web server architecture with controllers, services, and database integration, designed to serve ML-generated content via HTTP endpoints.",Other
https://github.com/baozh166/2025_llm,Semantic Medical Question Answering,Batch,"The repository implements a Retrieval-Augmented Generation (RAG) pipeline with vector database operations. The code shows batch-oriented workflows: ingest_vec.py loads and processes CSV data in bulk, embeds text, and uploads to Qdrant database. The main.py and run_test.sh demonstrate one-off query execution rather than continuous streaming or web service deployment. No streaming components (Kafka, Flink) or web service frameworks (Flask, FastAPI) are present.",Other
https://github.com/Saheed388/mediquest_project_full_code,AI Healthcare Recommendation Engine,Web Service,"The repository contains a FastAPI backend (main.py) that serves an AI-powered healthcare recommendation tool via API endpoints. The Dockerfile shows it runs uvicorn to serve the FastAPI application on port 8000, which is characteristic of a web service deployment pattern.",GCP
https://github.com/gkumarg/agentic_rag_streamlit/,Vector Database Knowledge Search,Web Service,"The repository contains a Streamlit application (app.py) that serves as a web interface for an agentic RAG chat application. The code shows a web service that provides interactive chat functionality through a web browser interface, with the main entry point being `streamlit run agentic_rag_streamlit/app.py`.",Other
https://github.com/ardnahh6/scholar-assistant,Vector Search Research Tool,Web Service,"The repository contains a Streamlit-based application (app/interface.py) that serves as a web interface for uploading PDFs, processing them, and querying via a natural language interface. The code structure shows a web service architecture with Streamlit for the UI, LangChain for document processing, and Ollama for local LLM inference.",Other
https://github.com/kachiann/nursing-mothers-rag-chatbot,Infant Care RAG System,Web Service,"The repository contains a Streamlit application (rag_chatbot_app.py) that serves a conversational AI chatbot via a web interface. The code shows a real-time RAG pipeline with semantic search that responds to user queries, which is characteristic of a web service deployment rather than batch processing or streaming.",Other
https://github.com/akumawavez/LLMzoomcamp2025/tree/main/cohorts/2025/project/AI_NutritionLabel_Explainer,Large Language Model Training Repository,Web Service,"The repository contains a Streamlit application (app.py) that serves an LLM-powered chat interface for nutrition label analysis. The code shows a web-based UI with API endpoints for user interaction, model inference, and RAG functionality - all characteristic of a web service deployment.",Unknown
https://github.com/jhuff-genomics/llm-project-research-assistant,PDF Research Assistant,Web Service,"The repository contains a FastAPI-based web service that serves as a research assistant interface. The code shows a web server container that handles user queries via HTTP endpoints (both web UI and curl API calls), with the main application logic implemented as a FastAPI app. The system is deployed as serverless containers on Modal Labs, which is a cloud container service for web services.",AWS
https://github.com/KrishnaG-101/AI-Healthcare-Assistant,Unknown,Unknown,No files fetched,Unknown
https://github.com/akumawavez/LLMzoomcamp2025/tree/main/cohorts/2025/project/attempt2,Local Real Estate LLM,Web Service,"The repository contains a Streamlit application (ChatApp_RAG_ollama_langchain.py) that serves as a web interface for a conversational chatbot. The code includes requirements for Streamlit and the README shows running ""streamlit run ChatApp_RAG_ollama_langchain.py"", indicating this is a web service deployment.",Other
https://github.com/KrishnaG-101/AI-Medical-Expert,AI Medical Encyclopedia Chatbot,Web Service,"The repository contains a FastAPI backend server (uvicorn main:app) and a Streamlit frontend (streamlit run app.py) that serve an AI medical chatbot via web interfaces. The code shows API endpoints for document parsing and LLM calls, indicating a web service architecture rather than batch or streaming processing.",Other
https://github.com/alexchugunoff/marketplace-seller-agent,Marketplace Seller Assistant,Web Service,"The repository contains a Streamlit application (app.py) that serves as a web interface for the marketplace seller assistant agent. The Dockerfile and docker-compose.yml are configured to run this Streamlit app on port 8501, indicating it's deployed as a web service for user interaction.",Other
