project_url,project_title,Deployment Type,Reason,Cloud
https://github.com/Deljimae/energy-analytics-rag,Global Power Plant Analytics,Web Service,"The repository contains a Flask application (app.py) that exposes an API endpoint for querying energy data using natural language. The application is containerized with Docker and uses Docker Compose to orchestrate services including the Flask app, PostgreSQL database, and Grafana. The primary deployment artifact is a web service that responds to HTTP requests, not scheduled batch jobs or streaming data pipelines.",Other
https://github.com/HagerAhmed/Musafir,Conversational Travel Search Platform,Web Service,"The repository contains a Streamlit application (app.py) served via Docker and docker-compose, with a web interface exposed on port 8501. The architecture includes a web service layer (Streamlit) that depends on backend services (Elasticsearch, PostgreSQL) but does not implement batch workflows or streaming pipelines.",Other
https://github.com/VeraTorka/nutrition-assistant,Nutrition Facts Chatbot,Web Service,"The repository contains a Flask application (app.py) that serves as a REST API for a nutrition chatbot. The Dockerfile exposes port 5000 and runs gunicorn to serve the Flask app. The docker-compose.yaml maps port 5000 to the host, indicating this is a web service deployment. While Grafana is included for visualization, it's not the primary ML service - the Flask app is the main web service component.",Other
https://github.com/nathadriele/credit-decision-LLM-RAG-platform,Credit Decision Platform,Batch,"The repository contains a complete MLOps platform with Airflow DAGs for orchestrating credit decision workflows, dbt models for data transformation, and scheduled ETL pipelines. The infrastructure includes EKS for container orchestration and RDS for data storage, indicating batch-oriented data processing rather than real-time streaming or web service deployment.",AWS
https://github.com/Rachel0619/VanTrails/tree/main,Vancouver Trail Metadata Filtering,Web Service,"The repository contains a Flask API service (vantrails-api) and a Gradio UI service (vantrails-ui) that serve the RAG application via HTTP endpoints. The Docker Compose configuration shows these services expose ports 8000 and 7860 respectively, indicating web service deployment rather than batch or streaming processing.",Other
https://github.com/lucapug/chat-with-my-notes,Document Retrieval Analytics Platform,Web Service,"The repository contains a FastAPI backend (pyproject.toml shows FastAPI dependency) serving a RAG system with a web interface (README mentions ""Web Interface"" and ""Responsive chat UI""). The architecture shows a FastAPI Backend handling user requests, document processing, and LLM interactions, indicating this is a web service that serves ML models and results via API.",Other
https://github.com/teighanmiller/HorizonZeroDawn_RAG,Game Wiki RAG System,Web Service,"The repository contains a Streamlit app (src/app.py) that serves as an interactive frontend for a Retrieval-Augmented Generation (RAG) system. The Docker Compose configuration shows a web service architecture with the app exposed on port 8501, and the README confirms this is a web-based question-answering interface accessible via browser at http://localhost:8501. While there are data ingestion components, the primary deployment pattern is a web service for user interaction.",Other
https://github.com/vanbastun/ffs_rag,Hybrid Retrieval Fantasy Football System,Web Service,"The repository contains a FastAPI application (src/api/main.py) that serves a RAG pipeline via HTTP endpoints. The Docker configuration and docker-compose file show it's designed to run as a web service on port 8000 with API endpoints for querying. There are no workflow orchestrators, message brokers, or streaming components present.",Other
https://github.com/nupsea/content-pal,Streaming Content Evaluation Suite,Web Service,"The repository contains a Flask API (src/modules/workflow/app.py) that serves search functionality via HTTP endpoints, with Docker configuration for containerized deployment. The architecture shows a web service pattern with Streamlit UI, Flask API backend, and PostgreSQL logging - all characteristic of a web service deployment rather than batch or streaming processing.",Other
https://github.com/Zainab-Omn/Slack_FAQ,Vector Search Slack Discussions,Web Service,"The repository contains a Streamlit application (app.py) served via Docker Compose on port 8501, with a Dockerfile and docker-compose.yml defining the web service infrastructure. The app provides an interactive UI for asking questions and receiving AI-generated answers, which is characteristic of a web service deployment.",Other
https://github.com/sancyb/PawfectMate,Dog Breed Matchmaker,Web Service,"The repository contains a FastAPI application (app.py) that serves as an API endpoint for a Retrieval-Augmented Generation (RAG) application. The Dockerfile exposes port 5000 and runs uvicorn to serve the FastAPI app. The docker-compose.yaml shows the app service running on port 5000, confirming this is a web service deployment.",Other
https://github.com/educapel/Health-Care-Assistant,Medical Entity Annotation System,Web Service,"The repository contains a Flask application (app:app) served via gunicorn in Docker, with a frontend React app, indicating a web service architecture. The Dockerfile and docker-compose setup show the application is designed to run as a web service on port 8000/5050, not as batch jobs or streaming pipelines.",Other
https://github.com/lkirch/ScienceSage,Space Exploration Q&A System,Web Service,"The repository contains a Streamlit app (app.py) and FastAPI service (rag_api.py) that serve the RAG system via web interfaces. The Dockerfile exposes ports 8501 (Streamlit) and 8000 (FastAPI), and the Makefile includes commands to run both web services. While there are data processing scripts, the primary deployment is as a web service for user interaction.",Other
https://github.com/bobbykim89/LLM-Project-LOTR,Middle-earth Semantic Search,Web Service,"The repository contains a Django REST Framework backend API and a Nuxt.js frontend application, both deployed as web services on Vercel. The system provides a conversational chat interface for character lookups, which is a web service use case rather than batch processing or streaming.",Other
https://github.com/iliasstefanidis/TheParrotLibrary,Unknown,Unknown,No files fetched,Unknown
https://github.com/ajbuzik/travel_assitant,Travel Recommendation RAG Demo,Web Service,"The repository contains a Streamlit application (app.py) that serves as a web interface for a travel assistant. The Dockerfile and docker-compose.yml show it's deployed as a web service on port 8501. Streamlit is a web framework for building interactive applications, not a streaming processing system.",Other
https://github.com/Tejanshu9/LegalMind,Legal Justice System Dashboard,Web Service,"The repository contains a Streamlit application (app.py) that serves as the main entry point for the LegalMind AI assistant. The application provides an interactive web interface for users to query legal information, and the docker-compose.yml shows it's containerized for deployment. This is a classic web service architecture serving ML/AI capabilities via a web interface.",Other
https://github.com/techwithcosta/youtube-rag-submission,Unknown,Unknown,No files fetched,Unknown
https://github.com/jesusoviedo/lus-laboris-py,Paraguay Labor Code RAG,Web Service,"The repository contains a FastAPI application (main.py, app/ directory) that serves a RAG system for Paraguay's Labor Code via API endpoints. The code shows a web service architecture with API routes for querying legal documents, health checks, and OpenAPI documentation. There are no workflow orchestrators, streaming components, or batch processing infrastructure visible in the codebase.",GCP
https://github.com/Deathslayer89/documind,Technical Document Intelligence System,Web Service,"The repository contains a Streamlit application (app.py) that serves as a web interface for document Q&A, with a Dockerfile exposing port 8501 and docker-compose configuration for running the service. The application uses LangChain for RAG pipeline processing and provides API endpoints for user interaction, which is characteristic of a web service deployment rather than batch or streaming processing.",Other
https://github.com/zainalabdeen/llm-zoomcamp/tree/main/customer-support,Customer Support RAG System,Web Service,"The repository contains a Streamlit application (main.py, frontend/app.py) that serves a customer support RAG system via web interface on ports 8501 (user app) and 8502 (dashboard). The Dockerfile and docker-compose.yml are configured to run this as a web service, not as batch jobs or streaming processing.",Other
https://github.com/alperugurca/playground/tree/main/llm_2025_project1,Learning Through Coding Experiments,Unknown,"The repository contains only a README.md file with no actual code, configuration files, or project structure that would indicate the deployment type (Batch, Web Service, or Streaming).",Unknown
https://github.com/sanchis135/LLM/tree/main/RAG_Occupational_Risk_Prevention,Risk Prevention Document Search,Web Service,"The repository contains a Streamlit application (app/ui_streamlit/Home.py) that serves as a web interface for interactive queries with an LLM. The Dockerfile and docker-compose.yml are configured to run this Streamlit app as a web service on port 8501. While there are ingestion and evaluation scripts, the primary deployment mechanism is the Streamlit web service.",Other
https://github.com/Mannerow/ubuntu-rag,Ubuntu Support RAG Assistant,"Batch, Web Service","The project includes a Streamlit web service for customer support chat (streamlit_app.py) and a Prefect orchestration pipeline (docker_setup_flow.py) for batch data processing and ingestion. The Streamlit app serves ML-powered responses via web interface, while Prefect manages scheduled/triggered batch jobs for data preprocessing and Elasticsearch indexing.",Other
https://github.com/NotYetBenGan/LLMZoomCamp/blob/main/Project/README.md,Qdrant Event Retrieval System,Web Service,"The repository contains a Dockerfile and docker-compose.yml that builds and runs a Streamlit application (scripts/app_streamlit.py) on port 8501. Streamlit is a web framework for creating interactive web applications, and the Docker configuration shows this is deployed as a web service. The project description confirms this is an ""interactive application"" with a ""Streamlit-based user interface"" for users to interact through a web application.",Other
https://github.com/Harunscodes/supermarket-rag-assistant,Retail Policy Retrieval System,Web Service,"The repository implements a CLI interface (run_agent.py) that serves an RAG agent via Ollama API calls, using Flask/FastAPI-like patterns for model serving. The code shows a service-oriented architecture where the agent responds to user queries in real-time, retrieving from Qdrant and Neo4j, then generating responses via Ollama. This is characteristic of a Web Service deployment pattern rather than batch or streaming.",Other
https://github.com/eadka/fridgechef,Vegetarian Recipe Recommendation Engine,Web Service,"The repository contains a Flask API (app.py) that serves recipe recommendations via HTTP endpoints, and is containerized with Docker/Docker Compose. The Streamlit UI is a visualization layer that consumes this API. There are no workflow orchestrators, batch schedulers, or streaming components like Kafka/Flink present.",Other
https://github.com/V4siliy/llm-manpage-rag/releases/tag/v0.1.0-alpha,Linux Man-Page Semantic Search,Web Service,"The repository contains a Django web application with Docker Compose setup for serving ML models and RAG capabilities via API endpoints. The main service is a Django application running on port 8000 with nginx reverse proxy, designed to serve search and Q&A functionality through web interfaces and RESTful APIs.",Other
https://github.com/Flow791/ScoutRAG,Football Stats Semantic Search,Web Service,"The repository contains a Gradio web application (`src/gradio_app.py`) that serves as a web interface for the football scouting assistant. The application is launched via `python run_app.py` and exposes a web UI on port 7860. The code shows a web service architecture with a frontend interface for user interaction, not batch processing or streaming components.",Other
https://github.com/rafaelladuarte/avesrag-assistant,Cerrado Biome Bird Search,Web Service,"The repository contains a Streamlit application (app/ directory with requirements.txt and Dockerfile) that serves an interactive bird identification assistant via a web interface on port 8501. The docker-compose.yml shows the app service exposing port 8501, confirming it's a web service. Streamlit is used for ML inference/assistant functionality, not for streaming data processing.",Other
https://github.com/nikhilj9/AWS-RAG-Assistant,AWS Bedrock Knowledge Assistant,Web Service,"The repository contains a Flask-based API (app.py) that serves a RAG assistant via REST endpoints (/question, /health). The Dockerfile and docker-compose.yml show it's designed to run as a web service container exposing port 5000/5001, not as batch jobs or streaming pipelines.",AWS
https://github.com/naivebird/job-matching-assistant#,Unknown,Unknown,No files fetched,Unknown
https://github.com/twu13/TrialGPT,Qdrant-Powered Trial Retrieval,Web Service,"The repository contains a Streamlit application (app/main.py) that serves as a web interface for querying clinical trials. The Dockerfile and docker-compose.yml are configured to run this Streamlit app as a web service on port 8501. While there are ingest/evaluation components, the primary deployment is the Streamlit web service for user interaction.",Other
https://github.com/razorcd/llm-project,Courier Support Agent RAG System,Web Service,"The repository contains a Flask application (app.py) that serves as an API server for a conversational AI agent. The Dockerfile exposes port 9696 and runs a Flask app, and docker-compose.yml shows the app service listening on ports 5000 and 9696. The application provides real-time conversational capabilities via API endpoints, which is characteristic of a Web Service deployment.",Other
https://github.com/Cabetico/project-rag,E-commerce Customer Support Chatbot,Web Service,"The repository contains a Flask API (e_commerce_rag/app.py) that serves a RAG-based chatbot, exposed on port 8000, and a Streamlit frontend on port 8501. Dockerfiles and docker-compose configurations show it's deployed as web services, not batch jobs or streaming pipelines.",Other
https://github.com/tanhtra/cookery-rag,Culinary Knowledge Retrieval System,Web Service,"The repository contains a Streamlit application (appcore.py) served via Docker container on port 8501, with Dockerfile and docker-compose.yml configurations for containerized web deployment. Streamlit is a web service framework for serving interactive applications.",Other
https://github.com/krish-rm/market-master-trading-decision-agent,Market Data Analysis Pipeline,Web Service,"The repository contains a Streamlit application (app/streamlit_app.py) that serves the trading decision agent via a web interface. The Dockerfile and docker-compose.yml are configured to run this Streamlit app on port 8501, indicating it's deployed as a web service for interactive market analysis and trading guidance.",Other
https://github.com/shayansm2/askhn/,Agentic RAG Search System,Web Service,"The repository contains a Go-based API server (cmd/api) and a React UI (ui/) that communicate via HTTP endpoints. The system exposes a REST API on port 8080 and a web interface on port 5173, with Docker Compose orchestrating these services. While Temporal workflows are used for orchestration, the primary deployment pattern is serving ML-powered RAG responses through web services rather than batch ETL or streaming data pipelines.",Other
https://github.com/clementlwm94/ziweidoushu,Chinese Astrology Chart Retrieval System,Web Service,"The repository contains a FastAPI application (`rag_api.py`) that serves a web UI and API endpoints for Zi Wei Dou Shu analysis. The code uses FastAPI to collect user input (birth details and questions) and return generated responses, which is characteristic of a web service deployment. There are no workflow orchestrators, scheduled jobs, or message brokers indicating batch or streaming patterns.",Other
https://github.com/gsenseless/tg_job_RAG,Job-Resume Matching System,Web Service,"The repository contains a Streamlit application (main.py) that serves as a web interface for job-resume matching. The Dockerfile and docker-compose.yml are configured to run this Streamlit app as a web service on port 8501, with health checks and external access. This is a web service deployment, not batch processing or streaming.",GCP
https://github.com/SapientSapiens/capstoneproject-2025-llmz,Survival Content RAG System,Web Service,"The repository contains two FastAPI services (rag/rag_service_serve.py) and a Streamlit app (interface_app/app.py) that are containerized and deployed as web services. The docker-compose.yml shows these services running on ports 8010 and 8501 respectively, with health checks and API endpoints. There are no workflow orchestrators, message brokers, or streaming components present.",Other
https://github.com/educapel/Fitness-assistant,Fitness Exercise Database,Web Service,"The repository contains a Flask application (app.py) that serves as a web service API for fitness assistance. It exposes REST endpoints for exercise search, chat, and feedback. The Dockerfile and docker-compose.yaml are configured to run this Flask app with Gunicorn web server, exposing port 8000. There are no workflow orchestrators (Airflow, Prefect), message brokers (Kafka, Kinesis), or streaming components present.",Other
https://github.com/Dcwind/llm-job-assistant,Career Insights Knowledge Base,Web Service,"The application is a Streamlit-based web interface (runs on port 8501) that serves as an interactive dashboard for job posting analysis. The Dockerfile and docker-compose.yml both expose port 8501 and run Streamlit as the main service, indicating this is a web service rather than batch or streaming processing.",Other
https://github.com/selesselvan/food-recipe-zoomcamp,Food Recipe Vector Database,Web Service,"The repository contains a Streamlit application (app.py) served via Docker container on port 8501, with Dockerfile and docker-compose.yml configurations for running the web service. Streamlit is a web framework for serving interactive applications, not batch processing or streaming.",Other
https://github.com/wingylui/LLMzoomcamp/tree/main,BakeBuddy Recipe Retrieval System,Web Service,"The repository contains a Streamlit application (streamlit_app.py) that serves as an interactive web interface for recipe search and feedback collection. The Dockerfile is configured to run this Streamlit app on port 8501, and docker-compose.yaml exposes it at http://localhost:8501. This is a classic web service deployment pattern where the application is served via HTTP endpoints for user interaction.",Other
https://github.com/Xue-Zhiming-Bruce/LLM-Zoomcamp-RAG-Project,Multilingual Podcast Retrieval System,Web Service,"The repository contains a FastAPI backend that serves a Retrieval-Augmented Generation (RAG) application via HTTP endpoints (e.g., /api/chat, /api/search, /api/health). The Dockerfile and docker-compose.yml are configured to run the FastAPI service, and the frontend is a static UI that interacts with this API. There are no workflow orchestrators, scheduled ETL jobs, or streaming components present.",Other
https://github.com/Erfan-ghiyasvand/Stardew-RAG-Farmhand,Wiki Content Search Engine,"Batch, Web Service","The repository contains a Streamlit web service (app.py) for user interaction with the RAG system, and a comprehensive data processing pipeline that includes web scraping, content processing, and vectorization - indicating batch processing of the Stardew Valley wiki content. The README mentions automated web scraping and ETL-like operations for building the knowledge base.",Other
https://github.com/rajindermavi/ScienceMadeEasy,Mathematical Research Retrieval System,"Batch, Web Service","The repository contains a batch ETL pipeline (run_etl.py) that processes ArXiv papers and indexes them, and a web service component (Streamlit app.py) that serves the RAG interface to users. The ETL pipeline runs scheduled jobs to fetch and process papers, while the Streamlit application provides a web-based interface for querying the indexed documents.",Other
https://github.com/Jaykold/llmzoomcamp-project,SQuAD RAG Chat Application,Web Service,"The repository contains a Streamlit application (app/app.py) that serves a RAG chat interface via web, with Docker Compose orchestrating the web service on port 8501. The application exposes an interactive web interface for question-answering, not batch ETL jobs or streaming data pipelines.",Other
https://github.com/glk08909/smart-travel-planner,Travel Knowledge Base Engine,Web Service,"The repository contains a Streamlit application (smart-travel-planner/planner/app.py) that serves as a web interface for travel planning, along with Docker configuration for containerization. The docker-compose.yml shows services exposing ports 8501 (Streamlit) and 3000, indicating web service deployment rather than batch or streaming processing.",Other
https://github.com/michaeljohnilagan/aspragers,Autism Spectrum Information Engine,Batch,"The repository contains a chatbot application that processes static data (PubMed abstracts) stored in CSV files. The application uses Docker for containerization and includes functionality to refresh data periodically via scripts, but there is no evidence of real-time streaming components (Kafka, Kinesis) or web service APIs (Flask, FastAPI). The data processing appears to be batch-oriented with scheduled updates to the dataset.",Other
https://github.com/yeoyingxin/travel-recommendations-japan,Reddit Travel Content Pipeline,Web Service,"The repository contains a Dockerfile and app.py that runs a Dash web application (a Python web framework) with Flask backend. The Dockerfile shows the app is started with ""python -u app.py --host=0.0.0.0"", indicating it's a web service. The code uses Qdrant for vector search and OpenAI for LLM responses, serving recommendations via a web interface. This is not a batch ETL job or streaming system.",Other
https://github.com/data-tomic/llm-zoomcamp/tree/main/06-project,Medical Document Processing Pipeline,"Batch, Web Service","The repository contains a scheduled ETL Kubernetes Job for data processing (Batch) and an Open WebUI service for user interaction (Web Service). The ETL job runs periodically to fetch, stage, chunk, embed, and load data, while the RAG pipeline serves real-time user queries via a web interface.",Other
https://github.com/wgb-10/dtc-book-archive-qa-system,Book Archive Q&A System,Web Service,"The repository contains a Streamlit application (streamlit>=1.50.0) that serves as a chatbot interface for querying the Book of the Week archive. The code structure shows this is a web-based application with a UI for user interaction, not a batch ETL job or streaming system.",Unknown
https://github.com/MohamedMostafa259/pif-multimodal-rag,Vector-Based Report Retrieval System,Web Service,"The repository contains a FastAPI backend (src/main.py) serving RAG endpoints (/api/v1/answer, /api/v1/compare) with a React frontend, plus Celery workers for background tasks. This is a classic web service architecture with API endpoints for interactive querying, not batch processing or streaming.",Other
https://github.com/ivano666/arizona-desert-plants-chat,Arizona Desert Plant Guide,Web Service,"The repository contains a FastAPI application (app.py) served via uvicorn in Docker, with a Dockerfile and docker-compose.yml defining the service. This is a classic web service deployment pattern for serving ML/RAG applications via REST API.",Other
https://github.com/freillat/FinReportingLLM,Financial Data RAG Pipeline,Web Service,"The repository contains a Streamlit application (app.py) served via Docker on port 8501, with a Docker Compose setup that defines an 'app' service exposing this web interface. The ingestion component is a one-time data preparation step, not a continuous deployment pattern.",Other
https://github.com/paty-oliveira/ai-assistant-self-employers-pt,Multilingual Government Guide,Web Service,"The repository contains a FastAPI backend (src/api.py) and a Streamlit frontend (app.py) that serve an AI assistant via web interfaces. The backend exposes API endpoints for chat requests, and the frontend provides an interactive web interface. Both components are containerized with Docker and designed to run as web services.",Other
https://github.com/zainalabdeen/llm-zoomcamp/tree/main/hr_assistant,Bilingual HR Legal Advisor,Web Service,"The repository contains a Streamlit application (app.py) that serves as an interactive web interface for the HR assistant. The app.py file shows a Streamlit-based web service that loads documents, creates vector embeddings, and provides a chat interface for users to ask questions about Saudi labor law. This is a web service deployment pattern where the application is served via Streamlit's web framework.",Unknown
https://github.com/bekarizz/llm-zoomcamp-project/tree/main,Industrial Database Natural Language Query,Web Service,"The project uses FastAPI (requirements.txt) and Docker Compose to serve a web application with APIs for natural language to SQL query generation. The architecture includes PostgreSQL, Qdrant, and Ollama services exposed via ports, indicating a web service deployment rather than batch or streaming.",Other
